{"artifact_sha256":{"call_edges.jsonl":"e66d1e48804bc76adb38b928197fd6775a555c3b9a820bfe2bdd130ac3118bfe","chunk_facts.jsonl":"f178582c815e172865b49f1e9295ad65b040afc67f977c9b1eaf3b23386c7160","file_index.jsonl":"fa888757f16921300503beafd7e1beb3373be9d2b789e670a89eaac581ad1868","include_edges.jsonl":"cf32cad8d42727f03fb71ac320d96503e2a870f2d307d84690d180dce81d0988","index_contract.json":"2d3f028a63615dad8c2f7620079ca36964137d1ec88ddc6ffa72592a22c78b8c","selected_batch_map.json":"db226f7734bb06d8c37e32ac73582a37b5cdfc76af4e9b08d51cbd6c2483cc04","symbol_index.jsonl":"cc0fc281c4a17caf3d740b19351d8e62325fdddb910a2769e8fa40ace1a72d0a"},"counts":{"call_resolutions":{"AMBIGUOUS":191,"INDIRECT_OR_DYNAMIC":40,"MACRO_OR_FUNCTION_AMBIGUOUS":1114,"MEMBER_OR_QUALIFIED":486,"UNIQUE_FILE_LOCAL_CANDIDATE":2357,"UNIQUE_REPOSITORY_CANDIDATE":4887,"UNRESOLVED_EXTERNAL":14624},"calls":23699,"chunk_facts":26645,"file_statuses":{"INDEXED":501,"NO_AST_NON_UTF8":5,"PARTIAL_DIAGNOSTIC":148},"files":654,"includes":2773,"symbols":19620,"terminal_errors":0},"experiment_id":"exp-v1-514885b1f9357adb0e1f4126","index_bundle_id":"I1-91c27db16b2222658d4a73e9","index_bundle_sha256":"91c27db16b2222658d4a73e90f049caf916e2a038ebfe40c418d485b746c5adb","index_data_bytes":108580424,"raw_source_or_security_judgment_stored":false,"reproducibility":{"builds_compared":2,"byte_identical":true,"status":"VERIFIED"},"schema_version":1,"source_bytes":8594578,"status":"PASS","target_commit_sha":"a54a0dbb2b8dcf9bafdddfc9a9374fb51d97e976","target_scope_sha256":"2d7910c98cd57192f9c80436d18d39be247a8b8e6705b98f831ee747b1d1d50a"}
